{
  "$schema": "https://json-schema.org/draft/2020-12/schema",
  "$id": "urn:mesh-plus:read:1:agent-profile",
  "type": "object",
  "properties": {
    "protocol": {
      "const": "agent-observer.mesh-candidate.v1"
    },
    "schemaVersion": {
      "const": 1
    },
    "mesh": {
      "$ref": "urn:mesh-plus:read:1:mesh"
    },
    "sessions": {
      "type": "array",
      "items": {
        "type": "object",
        "properties": {
          "identity": {
            "type": "object",
            "properties": {
              "hostScope": {
                "type": "string",
                "maxLength": 256,
                "minLength": 1,
                "pattern": "^[A-Za-z0-9][A-Za-z0-9_.-]{0,255}$"
              },
              "provider": {
                "enum": [
                  "codex",
                  "claude"
                ]
              },
              "namespace": {
                "type": "string",
                "maxLength": 71,
                "minLength": 1,
                "pattern": "^sha256:[0-9a-f]{64}$"
              },
              "nativeIdKind": {
                "enum": [
                  "thread",
                  "session"
                ]
              },
              "nativeId": {
                "type": "string",
                "maxLength": 36,
                "minLength": 1,
                "pattern": "^[0-9a-f]{8}(?:-[0-9a-f]{4}){3}-[0-9a-f]{12}$"
              }
            },
            "required": [
              "hostScope",
              "provider",
              "namespace",
              "nativeIdKind",
              "nativeId"
            ],
            "additionalProperties": false
          },
          "nativeIds": {
            "anyOf": [
              {
                "type": "object",
                "properties": {
                  "threadId": {
                    "type": "string",
                    "maxLength": 36,
                    "minLength": 1,
                    "pattern": "^[0-9a-f]{8}(?:-[0-9a-f]{4}){3}-[0-9a-f]{12}$"
                  },
                  "sessionTreeRootId": {
                    "type": "string",
                    "maxLength": 36,
                    "minLength": 1,
                    "pattern": "^[0-9a-f]{8}(?:-[0-9a-f]{4}){3}-[0-9a-f]{12}$"
                  }
                },
                "required": [
                  "threadId",
                  "sessionTreeRootId"
                ],
                "additionalProperties": false
              },
              {
                "type": "object",
                "properties": {
                  "sessionId": {
                    "type": "string",
                    "maxLength": 36,
                    "minLength": 1,
                    "pattern": "^[0-9a-f]{8}(?:-[0-9a-f]{4}){3}-[0-9a-f]{12}$"
                  }
                },
                "required": [
                  "sessionId"
                ],
                "additionalProperties": false
              }
            ]
          },
          "title": {
            "type": "string",
            "maxLength": 256,
            "minLength": 1
          },
          "kind": {
            "enum": [
              "user",
              "child",
              "unknown"
            ]
          },
          "cwd": {
            "type": [
              "string",
              "null"
            ],
            "maxLength": 4096
          },
          "cwdSource": {
            "type": [
              "string",
              "null"
            ],
            "maxLength": 128,
            "pattern": "^[a-z][a-z0-9_]{0,127}$"
          },
          "inventory": {
            "enum": [
              "live",
              "saved"
            ]
          },
          "hasSavedHistory": {
            "type": "boolean"
          },
          "phase": {
            "anyOf": [
              {
                "type": "object",
                "properties": {
                  "value": {
                    "enum": [
                      "working",
                      "blocked",
                      "waiting",
                      "unknown"
                    ]
                  },
                  "observedAt": {
                    "type": [
                      "integer",
                      "null"
                    ],
                    "minimum": 0,
                    "maximum": 4000000000000
                  },
                  "source": {
                    "type": [
                      "string",
                      "null"
                    ],
                    "maxLength": 128,
                    "pattern": "^[a-z][a-z0-9_]{0,127}$"
                  },
                  "health": {
                    "enum": [
                      "current",
                      "stale",
                      "unavailable",
                      "unsupported",
                      "ambiguous"
                    ]
                  },
                  "reason": {
                    "type": "string",
                    "maxLength": 128,
                    "minLength": 1,
                    "pattern": "^[a-z][a-z0-9_]{0,127}$"
                  },
                  "clock": {
                    "enum": [
                      "native",
                      "sample",
                      null
                    ]
                  },
                  "lastKnownValue": {
                    "enum": [
                      "working",
                      "blocked",
                      "waiting"
                    ]
                  }
                },
                "required": [
                  "value",
                  "observedAt",
                  "source",
                  "health",
                  "reason",
                  "clock"
                ],
                "additionalProperties": false
              },
              {
                "type": "null"
              }
            ]
          },
          "runtime": {
            "type": "object",
            "properties": {
              "value": {
                "enum": [
                  "running",
                  "parked",
                  "unknown"
                ]
              },
              "observedAt": {
                "type": [
                  "integer",
                  "null"
                ],
                "minimum": 0,
                "maximum": 4000000000000
              },
              "source": {
                "type": [
                  "string",
                  "null"
                ],
                "maxLength": 128,
                "pattern": "^[a-z][a-z0-9_]{0,127}$"
              },
              "health": {
                "enum": [
                  "current",
                  "stale",
                  "unavailable",
                  "unsupported",
                  "ambiguous"
                ]
              },
              "reason": {
                "type": "string",
                "maxLength": 128,
                "minLength": 1,
                "pattern": "^[a-z][a-z0-9_]{0,127}$"
              },
              "clock": {
                "enum": [
                  "native",
                  "sample",
                  null
                ]
              },
              "lastKnownValue": {
                "enum": [
                  "running",
                  "parked"
                ]
              }
            },
            "required": [
              "value",
              "observedAt",
              "source",
              "health",
              "reason",
              "clock"
            ],
            "additionalProperties": false
          },
          "outcome": {
            "type": "object",
            "properties": {
              "value": {
                "enum": [
                  "completed",
                  "failed",
                  "cancelled",
                  "unknown"
                ]
              },
              "observedAt": {
                "type": [
                  "integer",
                  "null"
                ],
                "minimum": 0,
                "maximum": 4000000000000
              },
              "source": {
                "type": [
                  "string",
                  "null"
                ],
                "maxLength": 128,
                "pattern": "^[a-z][a-z0-9_]{0,127}$"
              },
              "health": {
                "enum": [
                  "current",
                  "stale",
                  "unavailable",
                  "unsupported",
                  "ambiguous"
                ]
              },
              "reason": {
                "type": "string",
                "maxLength": 128,
                "minLength": 1,
                "pattern": "^[a-z][a-z0-9_]{0,127}$"
              },
              "clock": {
                "enum": [
                  "native",
                  "sample",
                  null
                ]
              },
              "lastKnownValue": {
                "enum": [
                  "completed",
                  "failed",
                  "cancelled"
                ]
              }
            },
            "required": [
              "value",
              "observedAt",
              "source",
              "health",
              "reason",
              "clock"
            ],
            "additionalProperties": false
          },
          "blockedReasons": {
            "type": "array",
            "items": {
              "enum": [
                "approval",
                "question"
              ]
            },
            "maxItems": 2
          },
          "createdAt": {
            "type": [
              "integer",
              "null"
            ],
            "minimum": 0,
            "maximum": 4000000000000
          },
          "activity": {
            "type": "object",
            "properties": {
              "at": {
                "type": [
                  "integer",
                  "null"
                ],
                "minimum": 0,
                "maximum": 4000000000000
              },
              "source": {
                "type": [
                  "string",
                  "null"
                ],
                "maxLength": 128,
                "pattern": "^[a-z][a-z0-9_]{0,127}$"
              },
              "health": {
                "enum": [
                  "current",
                  "stale",
                  "unavailable",
                  "unsupported",
                  "ambiguous"
                ]
              },
              "reason": {
                "type": "string",
                "maxLength": 128,
                "minLength": 1,
                "pattern": "^[a-z][a-z0-9_]{0,127}$"
              },
              "lastKnownAt": {
                "type": [
                  "integer",
                  "null"
                ],
                "minimum": 0,
                "maximum": 4000000000000
              }
            },
            "required": [
              "at",
              "source",
              "health",
              "reason"
            ],
            "additionalProperties": false
          },
          "workspace": {
            "anyOf": [
              {
                "type": "object",
                "properties": {
                  "health": {
                    "enum": [
                      "current",
                      "unavailable",
                      "unsupported"
                    ]
                  },
                  "reason": {
                    "type": "string",
                    "maxLength": 128,
                    "minLength": 1,
                    "pattern": "^[a-z][a-z0-9_]{0,127}$"
                  },
                  "root": {
                    "type": [
                      "string",
                      "null"
                    ],
                    "maxLength": 4096
                  },
                  "rootKey": {
                    "type": [
                      "string",
                      "null"
                    ],
                    "maxLength": 128,
                    "pattern": "^[A-Za-z0-9][A-Za-z0-9_.-]{0,255}$"
                  },
                  "relativePath": {
                    "type": [
                      "string",
                      "null"
                    ],
                    "maxLength": 4096
                  },
                  "projectKey": {
                    "type": [
                      "string",
                      "null"
                    ],
                    "maxLength": 256,
                    "pattern": "^[A-Za-z0-9][A-Za-z0-9_.-]{0,255}$"
                  },
                  "repo": {
                    "anyOf": [
                      {
                        "type": "object",
                        "properties": {
                          "root": {
                            "type": "string",
                            "maxLength": 4096,
                            "minLength": 1
                          },
                          "commonDir": {
                            "type": "string",
                            "maxLength": 4096,
                            "minLength": 1
                          },
                          "relativePath": {
                            "type": [
                              "string",
                              "null"
                            ],
                            "maxLength": 4096
                          }
                        },
                        "required": [
                          "root",
                          "commonDir",
                          "relativePath"
                        ],
                        "additionalProperties": false
                      },
                      {
                        "type": "null"
                      }
                    ]
                  }
                },
                "required": [
                  "health",
                  "reason",
                  "root",
                  "rootKey",
                  "relativePath",
                  "projectKey",
                  "repo"
                ],
                "additionalProperties": false
              },
              {
                "type": "null"
              }
            ]
          },
          "metadataIssues": {
            "type": "array",
            "items": {
              "type": "string",
              "maxLength": 128,
              "minLength": 1,
              "pattern": "^[a-z][a-z0-9_]{0,127}$"
            },
            "maxItems": 128
          }
        },
        "required": [
          "identity",
          "nativeIds",
          "title",
          "kind",
          "cwd",
          "cwdSource",
          "inventory",
          "hasSavedHistory",
          "phase",
          "runtime",
          "outcome",
          "blockedReasons",
          "createdAt",
          "activity",
          "workspace",
          "metadataIssues"
        ],
        "additionalProperties": false
      },
      "minItems": 0,
      "maxItems": 65536
    }
  },
  "required": [
    "protocol",
    "schemaVersion",
    "mesh",
    "sessions"
  ],
  "additionalProperties": false
}
