{
  "protocol": "agent-observer.mesh-candidate.v1",
  "schemaVersion": 1,
  "mesh": {
    "meshProtocol": 1,
    "requestId": "11111111111111111111111111111111",
    "operation": "snapshot",
    "access": "cached",
    "scope": {
      "hostIds": [
        "fixture"
      ]
    },
    "catalog": {
      "state": "local_only",
      "revision": null,
      "localHostId": "fixture"
    },
    "reader": {
      "id": "33333333-3333-4333-8333-333333333333",
      "clock": {
        "bootId": "00000000-0000-0000-0000-000000000001",
        "timeNamespace": "time:42"
      },
      "encodedAtMs": 2000,
      "sequence": 1,
      "revision": 1
    },
    "kind": "view",
    "status": "unavailable",
    "hosts": [
      {
        "hostId": "fixture",
        "local": true,
        "delivery": {
          "path": "ipc",
          "status": "unavailable",
          "epoch": 1,
          "routeToken": null,
          "error": {
            "code": "disconnected",
            "message": "Read channel ended"
          },
          "proof": null
        },
        "viewState": "historical",
        "owner": {
          "protocol": "agent-observer.snapshot",
          "version": 4,
          "metadata": {
            "schemaVersion": 4,
            "collectionId": "00000000-0000-0000-0000-000000000001",
            "collectedAt": 1700000020000,
            "host": {
              "authority": "fixture",
              "authoritySource": "caller",
              "nativeHostname": "fixture-host",
              "uid": 1000
            },
            "sourceHealth": "partial",
            "sources": [
              {
                "provider": "codex",
                "namespace": "sha256:3c8163925e07b2dda5954b37a6fec2e3a24888768884aff30939f2bf48f2eb9d",
                "runtimeNamespace": "sha256:aaaaaaaaaaaaaaaaaaaaaaaaaaaaaaaaaaaaaaaaaaaaaaaaaaaaaaaaaaaaaaaa",
                "configHome": "/fixture/codex",
                "configHomeKind": "explicit",
                "runtime": {
                  "version": "0.160.0",
                  "binarySha256": "0000000000000000000000000000000000000000000000000000000000000000",
                  "topology": "native_managed_endpoint",
                  "bootId": "00000000-0000-0000-0000-000000000001",
                  "pid": 123,
                  "startTicks": 123,
                  "endpoint": "/fixture/socket"
                },
                "sourceHealth": "current",
                "coverage": {
                  "saved": {
                    "status": "complete",
                    "reason": "native_snapshot"
                  },
                  "runtime": {
                    "status": "complete",
                    "reason": "native_snapshot",
                    "scope": "daemon_threads"
                  }
                },
                "capabilities": {
                  "phase": [
                    "working",
                    "blocked",
                    "waiting"
                  ],
                  "blockedReasons": [
                    "approval"
                  ],
                  "runtime": [
                    "running"
                  ],
                  "activity": false
                },
                "errors": [],
                "limitations": [
                  "activity_source_unproved",
                  "parked_predicate_unproved",
                  "questions_unproved",
                  "client_binding_unproved",
                  "offline_history_unavailable",
                  "unloaded_work_state_unavailable"
                ],
                "discovery": null
              },
              {
                "provider": "claude",
                "namespace": "sha256:9a437845594bdb34dd26451be43c068143f83601c03d7d62718d6f90a637fd5d",
                "runtimeNamespace": "sha256:aaaaaaaaaaaaaaaaaaaaaaaaaaaaaaaaaaaaaaaaaaaaaaaaaaaaaaaaaaaaaaaa",
                "configHome": "/fixture/claude",
                "configHomeKind": "explicit",
                "runtime": null,
                "sourceHealth": "partial",
                "coverage": {
                  "saved": {
                    "status": "partial",
                    "reason": "saved_child_roster_provider_excluded"
                  },
                  "runtime": {
                    "status": "partial",
                    "reason": "interactive_registration_assumed",
                    "scope": "provider_sessions"
                  }
                },
                "capabilities": {
                  "phase": [
                    "working",
                    "blocked",
                    "waiting"
                  ],
                  "blockedReasons": [
                    "approval",
                    "question"
                  ],
                  "runtime": [
                    "running",
                    "parked"
                  ],
                  "activity": true
                },
                "errors": [],
                "limitations": [
                  "interactive_runtime_only",
                  "native_registration_assumed",
                  "unregistered_interactive_runtime_unproved",
                  "background_runtime_unsupported",
                  "generic_dialog_unproved",
                  "saved_child_roster_provider_excluded"
                ],
                "discovery": null
              }
            ],
            "errors": [],
            "limitations": [
              "prerelease_contract",
              "host_local_only",
              "sampled_watch",
              "no_native_event_replay",
              "synthetic_contract_example"
            ]
          },
          "service": {
            "serviceProtocol": 2,
            "serviceId": "11111111-1111-4111-8111-111111111111",
            "bootId": "00000000-0000-0000-0000-000000000001",
            "uid": 1000,
            "hostScope": "fixture",
            "sequence": 1,
            "viewRevision": 1,
            "kind": "status",
            "state": "ready",
            "emittedAt": 1700000020000,
            "emittedBoottimeMs": 1000,
            "clock": "boottime",
            "clockDomain": "time:[42]",
            "reason": "native_snapshot",
            "sources": [
              {
                "provider": "codex",
                "namespace": "sha256:3c8163925e07b2dda5954b37a6fec2e3a24888768884aff30939f2bf48f2eb9d",
                "configHome": "/fixture/codex",
                "configHomeKind": "explicit",
                "contextGeneration": 1,
                "components": [
                  {
                    "name": "runtime",
                    "attempts": 1,
                    "accepted": 1,
                    "sampledBoottimeMs": 100,
                    "expiresBoottimeMs": 90100,
                    "health": "current",
                    "lastResult": "complete",
                    "inFlight": false
                  },
                  {
                    "name": "history",
                    "attempts": 1,
                    "accepted": 1,
                    "sampledBoottimeMs": 100,
                    "expiresBoottimeMs": 360100,
                    "health": "current",
                    "lastResult": "complete",
                    "inFlight": false
                  }
                ]
              },
              {
                "provider": "claude",
                "namespace": "sha256:9a437845594bdb34dd26451be43c068143f83601c03d7d62718d6f90a637fd5d",
                "configHome": "/fixture/claude",
                "configHomeKind": "explicit",
                "contextGeneration": 1,
                "components": [
                  {
                    "name": "runtime",
                    "attempts": 1,
                    "accepted": 1,
                    "sampledBoottimeMs": 100,
                    "expiresBoottimeMs": 90100,
                    "health": "current",
                    "lastResult": "complete",
                    "inFlight": false
                  },
                  {
                    "name": "history",
                    "attempts": 1,
                    "accepted": 1,
                    "sampledBoottimeMs": 100,
                    "expiresBoottimeMs": 360100,
                    "health": "current",
                    "lastResult": "complete",
                    "inFlight": false
                  }
                ]
              }
            ]
          }
        },
        "receipts": [
          {
            "sourceId": "codex:sha256:3c8163925e07b2dda5954b37a6fec2e3a24888768884aff30939f2bf48f2eb9d",
            "component": "runtime",
            "health": "stale",
            "accepted": 1,
            "remainingMs": 0,
            "expiresAtMs": null
          },
          {
            "sourceId": "codex:sha256:3c8163925e07b2dda5954b37a6fec2e3a24888768884aff30939f2bf48f2eb9d",
            "component": "history",
            "health": "stale",
            "accepted": 1,
            "remainingMs": 0,
            "expiresAtMs": null
          },
          {
            "sourceId": "claude:sha256:9a437845594bdb34dd26451be43c068143f83601c03d7d62718d6f90a637fd5d",
            "component": "runtime",
            "health": "stale",
            "accepted": 1,
            "remainingMs": 0,
            "expiresAtMs": null
          },
          {
            "sourceId": "claude:sha256:9a437845594bdb34dd26451be43c068143f83601c03d7d62718d6f90a637fd5d",
            "component": "history",
            "health": "stale",
            "accepted": 1,
            "remainingMs": 0,
            "expiresAtMs": null
          }
        ]
      }
    ],
    "extensions": {}
  },
  "sessions": [
    {
      "identity": {
        "hostScope": "fixture",
        "provider": "codex",
        "namespace": "sha256:3c8163925e07b2dda5954b37a6fec2e3a24888768884aff30939f2bf48f2eb9d",
        "nativeIdKind": "thread",